{
  "intent": {
    "issue_id": "sdp_dev-abc",
    "trigger": "user",
    "acceptance": [],
    "risk_class": "low"
  },
  "plan": {
    "workstreams": [],
    "ordering_rationale": ""
  },
  "execution": {
    "claimed_issue_ids": [],
    "branch": "main",
    "changed_files": []
  },
  "verification": {
    "tests": [],
    "lint": [],
    "contracts": [],
    "coverage": {"value": 80, "threshold": 80}
  },
  "review": {
    "self_review": [],
    "adversarial_review": []
  },
  "risk_notes": {
    "residual_risks": [],
    "out_of_scope": []
  },
  "boundary": {
    "declared": {
      "allowed_path_prefixes": [],
      "control_path_prefixes": [],
      "forbidden_path_prefixes": [],
      "role": "",
      "lane": ""
    },
    "observed": {
      "touched_paths": [],
      "out_of_boundary_paths": []
    },
    "compliance": {"ok": true, "reason": ""}
  },
  "provenance": {
    "run_id": "run-1",
    "orchestrator": "test",
    "runtime": "local",
    "model": "test",
    "gate_results": [],
    "phase": "execute",
    "role": "coder",
    "captured_at": "2026-01-01T00:00:00Z",
    "source_issue_id": "sdp_dev-abc",
    "artifact_id": "art-1",
    "contract_version": "artifact-provenance/v1",
    "hash_algorithm": "sha256",
    "sequence": 0,
    "payload_digest": "",
    "hash": "",
    "hash_prev": "",
    "prompt_hash": "e3b0c44298fc1c149afbf4c8996fb92427ae41e4649b934ca495991b7852b855",
    "context_sources": [
      {
        "type": "workstream_spec",
        "path": "docs/workstreams/backlog/00-026-01.md",
        "hash": "e3b0c44298fc1c149afbf4c8996fb92427ae41e4649b934ca495991b7852b855"
      }
    ]
  },
  "trace": {
    "beads_ids": [],
    "branch": "main",
    "commits": [],
    "pr_url": "https://github.com/org/repo/pull/1"
  }
}
